{
  "schema_version": "0.1",
  "ecaa_version": "0.2",
  "min_reader_version": "0.2",
  "package_iri": "ro-crate-metadata.json",
  "evaluated_at": "2026-06-02T00:44:20.464334953+00:00",
  "evaluator": {
    "impl": "ecaa-workflow-audit-proof",
    "version": "0.1.0",
    "policy": "warn-only"
  },
  "verdicts": [
    {
      "id": "claim_completeness",
      "status": "pass",
      "detail": null,
      "n_inspected": 0,
      "n_violations": 0
    },
    {
      "id": "decision_justification",
      "status": "unverified",
      "detail": "no method-choice decisions present",
      "n_inspected": 0,
      "n_violations": 0
    },
    {
      "id": "evidence_coverage",
      "status": "warn",
      "detail": "23 output(s) not referenced and not marked unused: workflow:discover_differential_expression, workflow:protein_quantification, workflow:survey_method_landscape, workflow:survey_method_landscape, workflow:survey_method_landscape, workflow:survey_method_landscape, workflow:reporting, workflow:differential_expression, workflow:discover_pathway_enrichment, workflow:data_acquisition, workflow:discover_peptide_search, workflow:discover_protein_quantification, workflow:peptide_search, workflow:differential_expression, workflow:pathway_enrichment, workflow:data_acquisition, workflow:data_acquisition, workflow:differential_expression, workflow:final_reporting, workflow:pathway_enrichment, workflow:peptide_search, workflow:protein_quantification, workflow:reporting",
      "n_inspected": 23,
      "n_violations": 23
    },
    {
      "id": "equivalence_failure",
      "status": "pass",
      "detail": null,
      "n_inspected": 0,
      "n_violations": 0
    },
    {
      "id": "cross_graph_integrity",
      "status": "pass",
      "detail": null,
      "n_inspected": 0,
      "n_violations": 0
    },
    {
      "id": "substrate_validity",
      "status": "unverified",
      "detail": "runcrate not run",
      "n_inspected": 1,
      "n_violations": 0
    }
  ]
}
