{
  "schema_version": "0.1",
  "ecaa_version": "0.1",
  "min_reader_version": "0.1",
  "package_iri": "ro-crate-metadata.json",
  "evaluated_at": "2026-06-02T00:44:21.678797908+00:00",
  "evaluator": {
    "impl": "ecaa-workflow-audit-proof",
    "version": "0.1.0",
    "policy": "warn-only"
  },
  "verdicts": [
    {
      "id": "claim_completeness",
      "status": "pass",
      "detail": null,
      "n_inspected": 0,
      "n_violations": 0
    },
    {
      "id": "decision_justification",
      "status": "unverified",
      "detail": "no method-choice decisions present",
      "n_inspected": 0,
      "n_violations": 0
    },
    {
      "id": "evidence_coverage",
      "status": "warn",
      "detail": "36 output(s) not referenced and not marked unused: workflow:discover_alignment, workflow:sequence_trimming, workflow:discover_differential_expression, workflow:normalisation, workflow:survey_method_landscape, workflow:survey_method_landscape, workflow:survey_method_landscape, workflow:survey_method_landscape, workflow:survey_method_landscape, workflow:survey_method_landscape, workflow:reporting, workflow:discover_normalisation, workflow:qc_preprocessing, workflow:differential_expression, workflow:discover_pathway_enrichment, workflow:quantification, workflow:alignment, workflow:discover_quantification, workflow:data_acquisition, workflow:differential_expression, workflow:pathway_enrichment, workflow:discover_sequence_trimming, workflow:raw_qc, workflow:data_acquisition, workflow:raw_qc, workflow:alignment, workflow:data_acquisition, workflow:differential_expression, workflow:final_reporting, workflow:normalisation, workflow:pathway_enrichment, workflow:qc_preprocessing, workflow:quantification, workflow:raw_qc, workflow:reporting, workflow:sequence_trimming",
      "n_inspected": 36,
      "n_violations": 36
    },
    {
      "id": "equivalence_failure",
      "status": "pass",
      "detail": null,
      "n_inspected": 0,
      "n_violations": 0
    },
    {
      "id": "cross_graph_integrity",
      "status": "pass",
      "detail": null,
      "n_inspected": 0,
      "n_violations": 0
    },
    {
      "id": "substrate_validity",
      "status": "unverified",
      "detail": "runcrate not run",
      "n_inspected": 1,
      "n_violations": 0
    }
  ]
}
