{
  "schema_version": "0.1",
  "ecaa_version": "0.1",
  "min_reader_version": "0.1",
  "package_iri": "ro-crate-metadata.json",
  "evaluated_at": "2026-06-02T00:44:08.627026764+00:00",
  "evaluator": {
    "impl": "ecaa-workflow-audit-proof",
    "version": "0.1.0",
    "policy": "warn-only"
  },
  "verdicts": [
    {
      "id": "claim_completeness",
      "status": "pass",
      "detail": null,
      "n_inspected": 0,
      "n_violations": 0
    },
    {
      "id": "decision_justification",
      "status": "unverified",
      "detail": "no method-choice decisions present",
      "n_inspected": 0,
      "n_violations": 0
    },
    {
      "id": "evidence_coverage",
      "status": "warn",
      "detail": "11 output(s) not referenced and not marked unused: workflow:reporting, workflow:time_series_forecast_evaluate, workflow:data_import, workflow:time_series_model_fit, workflow:time_series_decompose, workflow:data_import, workflow:final_reporting, workflow:reporting, workflow:time_series_decompose, workflow:time_series_forecast_evaluate, workflow:time_series_model_fit",
      "n_inspected": 11,
      "n_violations": 11
    },
    {
      "id": "equivalence_failure",
      "status": "pass",
      "detail": null,
      "n_inspected": 0,
      "n_violations": 0
    },
    {
      "id": "cross_graph_integrity",
      "status": "pass",
      "detail": null,
      "n_inspected": 0,
      "n_violations": 0
    },
    {
      "id": "substrate_validity",
      "status": "unverified",
      "detail": "runcrate not run",
      "n_inspected": 1,
      "n_violations": 0
    }
  ]
}
