{
  "ecaa_version": "0.2",
  "evaluated_at": "2026-06-12T21:40:57.230601983+00:00",
  "evaluator": {
    "impl": "ecaa-workflow-audit-proof",
    "policy": "warn-only",
    "version": "0.1.0"
  },
  "min_reader_version": "0.2",
  "package_iri": "ro-crate-metadata.json",
  "schema_version": "0.1",
  "verdicts": [
    {
      "detail": "no verified claims; signed verdict sink absent",
      "id": "claim_completeness",
      "n_inspected": 0,
      "n_violations": 0,
      "status": "unverified"
    },
    {
      "detail": "no method-choice decisions present",
      "id": "decision_justification",
      "n_inspected": 0,
      "n_violations": 0,
      "status": "unverified"
    },
    {
      "detail": "9 output(s) not referenced and not marked unused: runtime/outputs/data_acquisition/figures/samples_per_study.png, runtime/outputs/differential_expression/figures/top_features_heatmap.png, runtime/outputs/differential_expression/figures/volcano.png, runtime/outputs/final_reporting/figures/summary_dashboard.png, runtime/outputs/pathway_enrichment/figures/top_enriched_terms.png, runtime/outputs/protein_quantification/figures/peptide_coverage.png, runtime/outputs/protein_quantification/figures/ridgeline.png, runtime/outputs/reporting/figures/concordance_heatmap.png, runtime/outputs/reporting/figures/pathway_overlap_bar.png",
      "id": "evidence_coverage",
      "n_inspected": 9,
      "n_violations": 9,
      "status": "warn"
    },
    {
      "detail": "no re-execution performed (Q absent)",
      "id": "equivalence_failure",
      "n_inspected": 0,
      "n_violations": 0,
      "status": "unverified"
    },
    {
      "detail": "no cross-graph references present",
      "id": "cross_graph_integrity",
      "n_inspected": 0,
      "n_violations": 0,
      "status": "unverified"
    },
    {
      "detail": "runcrate not run",
      "id": "substrate_validity",
      "n_inspected": 1,
      "n_violations": 0,
      "status": "unverified"
    }
  ]
}
