{
  "schema_version": "0.1",
  "ecaa_version": "0.2",
  "min_reader_version": "0.2",
  "package_iri": "https://example.org/packages/complete-package",
  "evaluated_at": "2026-05-18T12:00:00Z",
  "evaluator": {
    "impl": "ecaa-workflow-audit-proof",
    "version": "0.1.0",
    "policy": "warn-only"
  },
  "verdicts": [
    {"id": "claim_completeness", "status": "pass", "detail": null, "n_inspected": 1, "n_violations": 0},
    {"id": "decision_justification", "status": "pass", "detail": null, "n_inspected": 1, "n_violations": 0},
    {"id": "evidence_coverage", "status": "pass", "detail": null, "n_inspected": 1, "n_violations": 0},
    {"id": "equivalence_failure", "status": "pass", "detail": null, "n_inspected": 0, "n_violations": 0},
    {"id": "cross_graph_integrity", "status": "pass", "detail": null, "n_inspected": 1, "n_violations": 0},
    {"id": "substrate_validity", "status": "pass", "detail": null, "n_inspected": 1, "n_violations": 0}
  ]
}
