{
  "schema_version": "0.1",
  "ecaa_version": "0.2",
  "min_reader_version": "0.2",
  "package_iri": "ro-crate-metadata.json",
  "evaluated_at": "2026-07-29T02:13:33.470172172+00:00",
  "evaluator": {
    "impl": "ecaa-workflow-audit-proof",
    "version": "0.1.0",
    "policy": "warn-only"
  },
  "verdicts": [
    {
      "id": "claim_completeness",
      "status": "pass",
      "detail": null,
      "n_inspected": 72,
      "n_violations": 0
    },
    {
      "id": "decision_justification",
      "status": "pass",
      "detail": null,
      "n_inspected": 3,
      "n_violations": 0
    },
    {
      "id": "evidence_coverage",
      "status": "pass",
      "detail": "2 declared claim-evidence output(s) all referenced or marked unused (retained output roles outside denominator: other analytical=12, presentation=19, intermediate=0, validation=1, retained input=2, superseded=0, administrative=36)",
      "n_inspected": 2,
      "n_violations": 0
    },
    {
      "id": "equivalence_failure",
      "status": "unverified",
      "detail": "no re-execution performed (Q absent)",
      "n_inspected": 0,
      "n_violations": 0
    },
    {
      "id": "cross_graph_integrity",
      "status": "pass",
      "detail": null,
      "n_inspected": 55,
      "n_violations": 0
    },
    {
      "id": "substrate_validity",
      "status": "unverified",
      "detail": "runcrate not run",
      "n_inspected": 1,
      "n_violations": 0
    }
  ]
}
